{
  "$schema": "https://json-schema.org/draft/2020-12/schema",
  "$id": "https://github.com/a-ghorbani/xebench/blob/main/data/benchmarks.schema.json",
  "title": "xebench benchmarks",
  "description": "Canonical cross-engine on-device LLM benchmark results published by xebench. This file is the stable contract for consumers (e.g. the pocketpal.dev leaderboard loads it dynamically). Contract 1.1 is additive over 1.0 and 1.2 over 1.1: every 1.0 and 1.1 file still validates. Additive changes bump the minor and breaking changes bump the major; consumers must reject a major they do not support. Rows are closed (additionalProperties false), so a consumer validating with this schema must be updated before a producer publishes a new minor's fields. Invariants this schema cannot express (dispersion min <= max, a real calendar generatedAt, one build.runtimes entry per name) are enforced by scripts/lib/publication.mjs.",
  "type": "object",
  "required": ["schemaVersion", "generatedAt", "source", "rows"],
  "properties": {
    "schemaVersion": {
      "type": "string",
      "pattern": "^1\\.(0|[1-9][0-9]*)$",
      "description": "MAJOR.MINOR of this contract (\"1.0\", \"1.1\" or \"1.2\"); a different major is unsupported and must be rejected as a whole"
    },
    "generatedAt": {
      "type": "string",
      "pattern": "^[0-9]{4}-[0-9]{2}-[0-9]{2}(T[0-9]{2}:[0-9]{2}:[0-9]{2}Z)?$",
      "description": "UTC time the file was last regenerated: YYYY-MM-DDTHH:MM:SSZ since 1.1; the date-only YYYY-MM-DD form of 1.0 remains valid"
    },
    "source": { "type": "string", "format": "uri" },
    "description": { "type": "string" },
    "rowCount": { "type": "integer", "minimum": 0 },
    "rows": { "type": "array", "items": { "$ref": "#/$defs/row" } }
  },
  "allOf": [
    {
      "$comment": "build.runtimes is a 1.2 field: a 1.0 or 1.1 file carries none",
      "if": { "required": ["schemaVersion"], "properties": { "schemaVersion": { "enum": ["1.0", "1.1"] } } },
      "then": {
        "properties": { "rows": { "items": { "properties": { "build": { "properties": { "runtimes": false } } } } } }
      }
    }
  ],
  "$defs": {
    "row": {
      "type": "object",
      "required": ["engine", "backend", "platform", "device", "model", "provenance", "sourceName", "sourceUrl"],
      "additionalProperties": false,
      "properties": {
        "engine": {
          "type": "string",
          "description": "inference engine id",
          "enum": ["llama.cpp", "executorch", "litert-lm", "genie-x", "mlx", "coreml", "apple-foundation-models", "mnn"]
        },
        "backend": { "type": "string", "enum": ["cpu", "gpu", "npu", "ane"] },
        "platform": { "type": "string", "enum": ["android", "ios", "macos"] },
        "device": { "type": "string", "description": "marketing device name, e.g. 'POCO F8 Ultra'" },
        "soc": { "type": "string", "description": "SoC id/name, e.g. 'SM8850'" },
        "model": { "type": "string", "description": "canonical model label, e.g. 'Llama 3.2 1B'" },
        "quant": { "type": "string", "description": "quantization scheme, e.g. 'Q4_0', 'W4A16'; ALWAYS surfaced, never hidden" },
        "ppTps": { "type": ["number", "null"], "description": "prefill tokens/sec (null if the source didn't report it); on measured rows the median of sampleCount successful repetitions" },
        "tgTps": { "type": ["number", "null"], "description": "decode tokens/sec (null if not reported); on measured rows the median of sampleCount successful repetitions" },
        "ttftMs": { "type": ["number", "null"] },
        "memoryMb": { "type": ["number", "null"] },
        "provenance": {
          "type": "string",
          "enum": ["measured", "vendor", "community"],
          "description": "who supplied the number: measured = xebench lab run; vendor = engine-maker official published number; community = third-party enthusiast benchmark. Provenance is not validation."
        },
        "sourceName": { "type": "string" },
        "sourceUrl": { "type": "string", "format": "uri" },
        "sourceDate": { "type": "string", "description": "YYYY-MM of the source measurement" },
        "sampleCount": { "type": "integer", "description": "n successful repetitions behind the medians" },
        "asStated": { "type": "string", "description": "human-readable methodology caveats for this row (quant, provenance method, protocol)" },
        "validation": {
          "type": "string",
          "enum": ["legacy", "unverified", "failed", "verified"],
          "description": "1.1, measured rows only. legacy = published before protocol/evidence validation existed; unverified = conditions not verified; failed = a validation or run-condition check failed; verified = guards passed and evidence is linked"
        },
        "guardsPassed": {
          "type": ["boolean", "null"],
          "description": "1.1, measured rows only. Run-condition guard outcome: true = passed, false = a condition failed (validation must be failed), null = not verified"
        },
        "conditionPolicy": { "type": "string", "description": "1.1, measured rows only. Run-condition policy id, e.g. 'observed-conditions-v1'" },
        "protocolVersion": { "type": "string", "description": "1.1, measured rows only. Measurement protocol id, e.g. 'cpu-reference-v1'" },
        "timingMethod": { "type": "string", "description": "1.1, measured rows only. How ppTps/tgTps were timed, e.g. 'engine-timings'" },
        "dispersion": {
          "type": "object",
          "additionalProperties": false,
          "description": "1.1, measured rows only; not on legacy rows. Spread of the successful repetitions behind ppTps/tgTps",
          "properties": {
            "ppTps": { "$ref": "#/$defs/spread" },
            "tgTps": { "$ref": "#/$defs/spread" }
          }
        },
        "evidence": {
          "type": "object",
          "additionalProperties": false,
          "required": ["sessionIds", "bundleSha256", "url"],
          "description": "1.1, measured rows only; required when verified, absent on legacy rows. Immutable sanitized evidence behind the row",
          "properties": {
            "sessionIds": { "type": "array", "minItems": 1, "uniqueItems": true, "items": { "type": "string", "minLength": 1 } },
            "bundleSha256": { "type": "string", "pattern": "^[0-9a-f]{64}$", "description": "lowercase hex SHA-256 of the evidence bundle" },
            "url": {
              "type": "string",
              "format": "uri",
              "pattern": "^https://[A-Za-z0-9.-]+(:[0-9]+)?([/?#][!-\\[\\]-~]*)?$",
              "description": "https URL of the immutable evidence bundle: a host (no credentials), printable ASCII only"
            }
          }
        },
        "build": {
          "type": "object",
          "additionalProperties": false,
          "description": "1.1, measured rows only. Identity of the software that produced the row. With runtimes (1.2), engineVersion and bindingVersion follow the fixed forms below",
          "properties": {
            "engineVersion": {
              "type": "string",
              "description": "the engine's own version, e.g. 'llama.cpp b11385 (bf9a0cc)', 'LiteRT-LM 0.18.0', 'Genie 1.19.0'"
            },
            "bindingVersion": { "type": "string", "description": "the app binding, e.g. 'llama.rn 0.13.0-rc.7'" },
            "apkSha256": { "type": "string" },
            "harnessCommit": { "type": "string" },
            "runtimes": {
              "type": "array",
              "minItems": 1,
              "uniqueItems": true,
              "description": "1.2, measured rows only. Each software component that ran, with its version; one entry per name (enforced by scripts/lib/publication.mjs)",
              "items": { "$ref": "#/$defs/runtime" }
            }
          },
          "if": { "required": ["runtimes"] },
          "then": {
            "properties": {
              "engineVersion": { "pattern": "^(llama\\.cpp b[0-9]{1,7} \\([0-9a-f]{7}\\)|(LiteRT-LM|Genie) [0-9]{1,5}(\\.[0-9]{1,12}){1,3}(-[0-9A-Za-z]{1,16}(\\.[0-9A-Za-z]{1,16}){0,3})?)$" },
              "bindingVersion": { "pattern": "^llama\\.rn [0-9]{1,5}(\\.[0-9]{1,12}){1,3}(-[0-9A-Za-z]{1,16}(\\.[0-9A-Za-z]{1,16}){0,3})?$" }
            }
          }
        }
      },
      "allOf": [
        {
          "$comment": "1.1 fields are valid on provenance=measured rows only",
          "if": { "required": ["provenance"], "properties": { "provenance": { "const": "measured" } } },
          "else": {
            "properties": {
              "validation": false, "guardsPassed": false, "conditionPolicy": false, "protocolVersion": false,
              "timingMethod": false, "dispersion": false, "evidence": false, "build": false
            }
          }
        },
        {
          "$comment": "verified requires guardsPassed === true and evidence",
          "if": { "required": ["validation"], "properties": { "validation": { "const": "verified" } } },
          "then": { "required": ["guardsPassed", "evidence"], "properties": { "guardsPassed": { "const": true } } }
        },
        {
          "$comment": "guardsPassed=false requires validation failed",
          "if": { "required": ["guardsPassed"], "properties": { "guardsPassed": { "const": false } } },
          "then": { "required": ["validation"], "properties": { "validation": { "const": "failed" } } }
        },
        {
          "$comment": "legacy rows carry no dispersion or evidence; a measured row without validation (1.0) is legacy",
          "if": { "properties": { "validation": { "const": "legacy" } } },
          "then": { "properties": { "dispersion": false, "evidence": false } }
        }
      ]
    },
    "runtime": {
      "type": "object",
      "additionalProperties": false,
      "required": ["name", "version"],
      "description": "1.2. One software component of the row's build",
      "properties": {
        "name": {
          "type": "string",
          "enum": ["llama.cpp", "llama.rn", "LiteRT-LM", "litert-npu-runtime-qualcomm", "QAIRT", "Genie"]
        },
        "version": {
          "type": "string",
          "maxLength": 64,
          "pattern": "^(b[0-9]{1,7}|[0-9]{1,5}(\\.[0-9]{1,12}){1,3}(-[0-9A-Za-z]{1,16}(\\.[0-9A-Za-z]{1,16}){0,3})?)$",
          "description": "a llama.cpp build ('b11385') or a dotted version with an optional pre-release ('0.13.0-rc.7', '2.50.0.260828221209'), at most 64 characters"
        }
      }
    },
    "spread": {
      "type": "object",
      "additionalProperties": false,
      "required": ["iqr", "min", "max"],
      "description": "finite non-negative tokens/sec; min <= max (enforced by scripts/lib/publication.mjs)",
      "properties": {
        "iqr": { "type": "number", "minimum": 0 },
        "min": { "type": "number", "minimum": 0 },
        "max": { "type": "number", "minimum": 0 }
      }
    }
  }
}
