{
  "schemaVersion": "1.1",
  "generatedAt": "2026-10-17T12:00:00Z",
  "source": "https://github.com/a-ghorbani/xebench",
  "description": "Contract 1.1 consumer fixture: a vendor row (copied from data/benchmarks.json). Vendor rows carry none of the 1.1 fields; render as a vendor claim, never as verified.",
  "rowCount": 1,
  "rows": [
    {
      "engine": "litert-lm",
      "backend": "cpu",
      "platform": "android",
      "device": "Google Pixel 7 Pro",
      "model": "FunctionGemma 270M",
      "quant": "not stated",
      "ppTps": 1916,
      "tgTps": 142,
      "asStated": "1916 tok/s prefill, 142 tok/s decode on CPU",
      "sourceName": "Google Developers Blog (AI Edge Gallery)",
      "sourceUrl": "https://developers.googleblog.com/on-device-function-calling-in-google-ai-edge-gallery/",
      "sourceDate": "2026-02",
      "provenance": "vendor"
    }
  ]
}
