{
  "schemaVersion": "1.2",
  "generatedAt": "2026-10-18T12:00:00Z",
  "source": "https://github.com/a-ghorbani/xebench",
  "description": "Contract 1.2 consumer fixture (reject): build (and its runtimes) on a vendor row.",
  "rowCount": 1,
  "rows": [
    {
      "engine": "litert-lm",
      "backend": "cpu",
      "platform": "android",
      "device": "Google Pixel 7 Pro",
      "model": "FunctionGemma 270M",
      "quant": "not stated",
      "ppTps": 1916,
      "tgTps": 142,
      "asStated": "1916 tok/s prefill, 142 tok/s decode on CPU",
      "sourceName": "Google Developers Blog (AI Edge Gallery)",
      "sourceUrl": "https://developers.googleblog.com/on-device-function-calling-in-google-ai-edge-gallery/",
      "sourceDate": "2026-02",
      "provenance": "vendor",
      "build": {
        "runtimes": [
          {
            "name": "LiteRT-LM",
            "version": "0.18.0"
          },
          {
            "name": "litert-npu-runtime-qualcomm",
            "version": "2.3.0"
          },
          {
            "name": "QAIRT",
            "version": "2.50.0.260828221209"
          }
        ]
      }
    }
  ]
}
