{
  "schemaVersion": "1.0",
  "generatedAt": "2026-07-22",
  "source": "https://github.com/a-ghorbani/xebench",
  "description": "Contract 1.0 consumer fixture (pre-migration shape, e.g. an old bundled fallback): date-only generatedAt and a measured row without validation. Still valid under 1.1; treat the measured row as legacy.",
  "rowCount": 1,
  "rows": [
    {
      "engine": "llama.cpp",
      "backend": "cpu",
      "platform": "android",
      "device": "Google Pixel 9",
      "soc": "Tensor G4",
      "model": "Llama 3.2 1B",
      "quant": "Q4_K_M",
      "ppTps": 144,
      "tgTps": 24.1,
      "ttftMs": 3282,
      "memoryMb": null,
      "provenance": "measured",
      "sourceName": "PocketPal R&D lab (xebench)",
      "sourceUrl": "https://github.com/a-ghorbani/xebench/blob/main/METHODOLOGY.md",
      "sampleCount": 3,
      "asStated": "n=3 cold-run median; prompt std-pp512-v1; decode 128 tok"
    }
  ]
}
